file,id,note,English,Arabic
Clew/localizations/en.lproj/Localizable.strings,forYourSafetyPop-UpContent,Disclaimer shown to the user when they open the app for the first time,"While using the app, please be aware of your surroundings. You agree that your use of the App is at your own risk, and it is solely your responsibility to maintain your personal safety. Visit www.clewapp.org for more information on how to use the app.","عند استخدامك للتطبيق، الرجاء أخذ الحيطة والانتباه لمحيطك.
باستخدامك للتطبيق أنت تقر وتوافق على أن استخدامك للتطبيق يقع ضمن مسؤوليتك الخاصة فقط، فأنت وحدك المسؤول   عن حماية سلامتك الشخصية.
الرجاء التفضل بزيارة www.clewapp.org للمزيد من المعلومات حول كيفية استخدام التطبيق."
Clew/localizations/en.lproj/Localizable.strings,forYourSafetyPop-UpHeading,The heading of a pop-up telling the user to be aware of their surroundings while using clew,For your safety,من أجل سلامتك
Clew/localizations/en.lproj/Localizable.strings,getDirectionsButtonAccessibilityLabel,This is the accessibility label for the get directions button,Get Directions,الحصول على الاتجاهات
Clew/localizations/en.lproj/Localizable.strings,gettingBackToTheCorrectPathTutorialInstructionTextParagraph1,Text that explains getting back to the correct path paragraph 1,"A distinct tone will play whenever you are off the correct path. This may also happen if your phone is not facing in the direction of the path. If you find yourself off the path, you should stop, try turning around until you hear the 'ticking' sounds that indicate that you're on the correct direction of the path.",
Clew/localizations/en.lproj/Localizable.strings,gettingBackToTheCorrectPathTutorialInstructionTextParagraph2,Text that explains getting back to the correct path paragraph 2,Press the 'Get Directions' button to receive audio directions on how to get back on the route. This is especially helpful if you've become disoriented or off the correct path.,
Clew/localizations/en.lproj/Localizable.strings,gettingBackToTheCorrectPathTutorialTitleText,Title for the getting back to the path part of the tutorial,Getting Back to the Correct Path,
Clew/localizations/en.lproj/Localizable.strings,goodServiceButtonAccessibilityLabel,,Good,جيد
Clew/localizations/en.lproj/Localizable.strings,helpButtonAccessibilityLabel,This is the accessibility label for the help button,Help,المساعدة
Clew/localizations/en.lproj/Localizable.strings,homeAlertConfirmNavigationButton,This text appears on a button in an alert notifying the user that if they navigate to the home page they will stop their curent process. This text appears on the button which signifies that the user wants to continue to the home screen,Go to the Home Page,أِذهب إلى الصفحة الرئيسية
Clew/localizations/en.lproj/Localizable.strings,homeAlertContent,this is the content of an alert which tells the user that if they continue with going to the home page the current process will be stopped.,"If you exit this process right now, your active route information will be lost.",إذا خرجت الآن من هذه العملية ، ستفقد معلومات الطريق الحالي.
Clew/localizations/en.lproj/Localizable.strings,homeAlertTitle,GoHomeAlert,Are you sure?,هل أنت متأكد؟
Clew/localizations/en.lproj/Localizable.strings,homeButtonAccessibilityLabel,This is the accessibility label for the home button,Clew Home Screen,الصفحة الرئيسية
Clew/localizations/en.lproj/Localizable.strings,howWellDoesClewWorkContentParagraph1,This is a paragraph in the How well does Clew work? section of the help documentation. This paragraph describes how the app actually works,"Clew relies on the position tracking technology provided by Apple's ARKit. These motion estimates are based on tracking elements in the environment visually (using your phone's camera) and on motion estimates from inertial sensors in your phone. While this technology is advanced, it does not work perfectly. You should expect that over very long routes, particular ones with limited visual features or poor lighting, that the accuracy of the tracking (and hence the app's guidance) will decrease. We have found that Clew works best when you navigate routes along the same direction as they were originally recorded (&quot;Start to End &quot; rather than &quot;End to Start &quot; navigation mode).","يعتمد Clew أثناء التنقل على تكنولوجيا الواقع المعزز المقدمة من آبل.
ويعتمد تقدير الحركة على الرؤية في المكان (وذلك باستخدام كاميرا الهاتف) ويعتمد التطبيق أيضا على المستشعرات الخاصة بالهاتف.
فبالرغم من أن هذه التكنولوجيا متقدما جدا، فهي لا تعمل بشكل احترافي.
توقع دائما أثناء تنقلك في الطرق الطويلة انخفاضا في دقة اتجاهات وإرشادات التطبيق وخاصة في الطرق التي تحتوي على رؤية معدومة، أو أضواء خافتة.
قد لحظنا بأن Clew يعمل بشكل جيد عند التنقل في الطرق باستخدام نفس الاتجاهات المسجلة مسبقا، فينصح باستخدام وضع التنقل (من البداية للنهاية، بدلا من النهاية للبداية."
Clew/localizations/en.lproj/Localizable.strings,howWellDoesClewWorkContentParagraph2,This is a paragraph in the How well does Clew work section of the help documentation. This paragraph describes how users should use CLew to supplement their orientation and mobility skills rather than using the app as a replacement for their traditional. orientation and mobility skills,"Given the limitations of Clew, you should always use your orientation and mobility skills to ensure your personal safety when using Clew. We are working on additional strategies for improving the accuracy of Clew.","عند استخدامك للتطبيق، لا تقم بالاعتماد دائما على Clew, ويجب عليك دائما استخدام مهاراتك الحركية، وتكييف نفسك دائما مع الظروف المحيطة بك للحفاظ على سلامتك الخاصة.
نحن نعمل على خلق استراتيجيات إضافية لتحسين دقة Clew."
Clew/localizations/en.lproj/Localizable.strings,howWellDoesClewWorkHeader,This is a section heading in the help documentation menu,How well does Clew work?,كيف يعمل Clew?
Clew/localizations/en.lproj/Localizable.strings,imperialUnitText,this is the text which is displayed in the settings to show the user the option of imperial measurements, feet,أقدام
Clew/localizations/en.lproj/Localizable.strings,insuficientFeaturesDegradedTrackingAnnouncemnt,An announcement which lets the user know  that their current surroundings do not have enough visual markers and thus the app's ability to track a route has been lowered.,"Insufficient visual features.
Tracking performance is degraded.","ميزات الرؤية معدومة.
تتبع الأداء منخفض."
Clew/localizations/en.lproj/Localizable.strings,introClewsRoleTutorialTextParagraph1,Text for intro to Clew's role Page Paragraph 1,"Clew is not a substitute for your orientation and mobility skills. It is not a replacement for your white cane, guide dog or primary mobility aid. Clew is intended to work as an additional aid or to complement and enhance your orientation and navigation skills.",
Clew/localizations/en.lproj/Localizable.strings,introClewsRoleTutorialTextParagraph2,Text for intro to Clew's role Page Paragraph 2,Please be aware of your surroundings while using the app. It is your responsibility to maintain your personal safety at all times while using Clew.,
Clew/localizations/en.lproj/Localizable.strings,introClewsRoleTutorialTextParagraph3,Text for intro to Clew's role Page Paragraph 3,"If you are new to Clew, we recommend that you first use the app in an indoor setting that is safe and familiar to you.",
Clew/localizations/en.lproj/Localizable.strings,introClewsRoleTutorialTextParagraph4,Text for intro to Clew's role Page Paragraph 4,You acknowledge and agree that your use of the app is at your own risk.,
Clew/localizations/en.lproj/Localizable.strings,introClewsRoleTutorialTitle,Title for intro to Clew's role Page,Important Safety Info - Clew's Intended Role,
Clew/localizations/en.lproj/Localizable.strings,introUsingClewTextParagraph1,Text for intro to Using Clew Page Paragraph 1,"Clew helps you find your way around indoors spaces by recording your route when you're going from one place to another. For example, from a lobby area to a room. By recording your route, Clew then helps you navigate your way back to where you started. Clew can help you learn a new environment, so you can confidently navigate it in the future.",
Clew/localizations/en.lproj/Localizable.strings,introUsingClewTextParagraph2,Text for intro to Using Clew Page Paragraph 2,Clew is best used indoors. The app doesn't rely on your phone's GPS. This means that Clew is limited in outdoors spaces and for routes over long distances.,
Clew/localizations/en.lproj/Localizable.strings,introUsingClewTitle,Title for intro to Using Clew Page,Using Clew,
Clew/localizations/en.lproj/Localizable.strings,introUsingClewTutorialText,Text for intro to Using Clew Tutorial Page,This tutorial will help you learn the skills needed to use Clew. Each module focuses on a particular skill set and feature of the app. Some of the modules include interactive practice exercises. We recommend that you first use the app in an indoor setting that is safe and familiar to you.,
Clew/localizations/en.lproj/Localizable.strings,introUsingClewTutorialTitle,Title for intro to Using Clew Tutorial Page,Using This Tutorial,
Clew/localizations/en.lproj/Localizable.strings,leftDirection,Direction to the user to make an approximately 90 degree left turn.,Turn left,اِنعَطِف يساراً
Clew/localizations/en.lproj/Localizable.strings,metricUnitText,this is the text which is displayed in the settings to show the user the option of metric measurements, meters,أمتار
Clew/localizations/en.lproj/Localizable.strings,moduleCompleted,played as the accessibility hint in the tutorial to indicate that the current module has been completed,Module Completed,
Clew/localizations/en.lproj/Localizable.strings,moduleNotCompleted,played as the accessibility hint in the tutorial to indicate that the current module has not been completed,Module Not Completed,
Clew/localizations/en.lproj/Localizable.strings,movingOnCorrectPathInstructionTextParagraph1,Text that explains how to move on the correfct path paragraph 1,"Whenever you begin navigating a route, you will hear a distinct 'ticking' sound. Clew plays the ticking sound whenever you are correctly aligned to the route. It will play through the entire time until you complete the route, pause or stop navigation.",
Clew/localizations/en.lproj/Localizable.strings,movingOnCorrectPathInstructionTextParagraph2,Text that explains how to move on the correfct path paragraph 2,Sighted users will see a colored line showing the correct path on the screen. The path color can be changed in the settings.,
Clew/localizations/en.lproj/Localizable.strings,movingOnCorrectPathTitleText,Title for the moving on the correfct path,Moving Along the Correct Path,
Clew/localizations/en.lproj/Localizable.strings,multipleUseRouteAnchorPointToRecordingRouteAnnouncement,This is the announcement which is spoken after the first anchor point of a multiple use route is saved. this signifies the completeion of the saving an anchor point procedure and the start of recording a route to be saved.,Anchor point saved. You are now recording a route.,تم حفظ النقطة الثابتة. أنت الآن تقوم بتسجيل الطريق.
Clew/localizations/en.lproj/Localizable.strings,multipleUseRouteAnchorPointToSaveARouteAnnouncement,This is an announcement which is spoken when the user saves the end anchor point for a multiple use route. This signifies the transition from saving an anchor point to the screen where the user can name and save their route,Anchor point saved. You may now name your route.,تم حفظ النقطة الثابتة. يمكنك الآن تسمية الطريق الخاص بك.
Clew/localizations/en.lproj/Localizable.strings,multipleUseRouteEndAnchorPointText,Information on how to record an anchor point when used recording the ending anchor point of a multiple use route.,"To allow your route to be navigated in the reverse direction you need to record an anchor point for the end of your route. An anchor point records the position and alignment of your device so the app can reload your route from a saved file. As a result the accuracy of your saved route navigation relies entirely on how accurately you can realign and position your phone with your saved anchor point at a later point. We suggest using the text and voice note buttons to record a text note and/or a voice recording which can help you realign your device to the anchor point you recorded at a later time.
To create an anchor point, hold your device flat with the screen facing up. Press the top (short) edge flush against a flat vertical surface (such as a wall) the ”align” button starts a %lu-second countdown. The countdown is intended to give you time to position your device; the anchor point will be saved at the end of the countdown.","ولكي تتمكن من استخدام الطريق بشكل عكسي، يجب عليك تسجيل نقطة ثابتة في نهاية الطريق. 
تسجل النقطة الثابتة موقع واتجاه الهاتف الخاص بك، فيمكن للتطبيق إعادة تحميل الطريق عن طريق الملف المحفوظ.
ونتيجة لذلك، تعتمد دقة الطريق المحفوظ على مدى قدرتك على المحاذاة ومطابقة الهاتف مع النقطة الثابتة التي تم تسجيلها.
ننصحك باستخدام زري النص والملحوظة الصوتية لكتابة ملحوظة أو تسجيلها لمساعدتك على محاذاة الهاتف مع نفس النقطة التي قمت بتسجيلها.
وللقيام بتسجيل نقطة ثابتة: يجب عليك وضع هاتفك بشكل ثابت، ثم وجه الشاشة لأعلى واضغط على الجزء العلوي (الزاوية القصيرة من الهاتف) وسيبدأ العد التنازلي.
ويهدف العد التنازلي لمنحك الوقت لإجراء التعديلات النهائية على اتجاه جهازك. وسيتم حفظ النقطة الثابتة عندما ينتهي العد التنازلي."
Clew/localizations/en.lproj/Localizable.strings,multipleUseRoutePlayPauseViewText,Information displayed to the user on the play pause screen after they have just recorded a multiple use route. This describes the functionality of the play and pause buttons.,"In order to immediately navigate back along the path you recorded, press the play button and follow the instructions provided. If you'd like to navigate the route later, you can return to the home screen and load the route you've just saved when you're ready to navigate along it.","ولكي تتمكن من العودة إلى الطريق الذي قمت بتسجيله، اضغط على زر التشغيل، ثم اتبع الإرشادات المقدمة لك.
إذا رغبت في العودة لاحقا، فيمكنك الرجوع إلى الصفحة الرئيسية ثم قم بتحميل الطريق الذي قمت بحفظه للتو عند رغبتك في العودة له مجددا."
Clew/localizations/en.lproj/Localizable.strings,multipleUseRouteStartAnchorPointText,Information on how to record an anchor point when used recording the starting anchor point of a multiple use route.,"To allow your route to be navigated at a later point you need to record an anchor point for the start of your route. An anchor point records the position and alignment of your device so the app can reload your route from a saved file. As a result the accuracy of your saved route navigation relies entirely on how accurately you can realign and position your phone with your saved anchor point at a later point. We suggest using the text and voice note buttons to record a text note and/or a voice recording which can help you realign your device to the anchor point you recorded at a later time.
To create an anchor point, hold your device flat with the screen facing up. Press the top (short) edge flush against a flat vertical surface (such as a wall) the ”align” button starts a %lu-second countdown. The countdown is intended to give you time to position your device; the anchor point will be saved at the end of the countdown.","لكي تتمكن من استخدام الطريق في وقت لاحق، يجب عليك تسجيل نقطة ثابتة في بداية الطريق. 
تسجل النقطة الثابتة موقع واتجاه الهاتف الخاص بك، فيمكن للتطبيق إعادة تحميل الطريق عن طريق الملف المحفوظ.
ونتيجة لذلك، تعتمد دقة الطريق المحفوظ على مدى قدرتك على المحاذاة ومطابقة الهاتف مع النقطة الثابتة التي تم تسجيلها.
ننصحك باستخدام زري النص والملحوظة الصوتية لكتابة ملحوظة أو تسجيلها لمساعدتك على محاذاة الهاتف مع نفس النقطة التي قمت بتسجيلها.
وللقيام بتسجيل نقطة ثابتة: يجب عليك وضع هاتفك بشكل ثابت، ثم وجه الشاشة لأعلى واضغط على الجزء العلوي (الزاوية القصيرة من الهاتف) وسيبدأ العد التنازلي.
ويهدف العد التنازلي لمنحك الوقت لإجراء التعديلات النهائية على اتجاه جهازك. وسيتم حفظ النقطة الثابتة عندما ينتهي العد التنازلي."
Clew/localizations/en.lproj/Localizable.strings,nameSavedRouteLabel,Message displayed to the user when saving a route by name.,Type your route name below,اكتب اسم الطريق الخاص بك أدناه
Clew/localizations/en.lproj/Localizable.strings,nameSavedRouteTextField,Message displayed to the user when typing to save a route by name.,Enter route name here,اكتب اسم الطريق
Clew/localizations/en.lproj/Localizable.strings,namingYourRouteTutorialText,Instructions for naming your route,"Once you've recorded the route and set your end anchor point, Clew will prompt you to name your route. We recommend using a name that best describes the route and that you'll remember at a later time.",
Clew/localizations/en.lproj/Localizable.strings,namingYourRouteTutorialTitle,Title for the naming your route part of the tutorial,Naming your Route,
Clew/localizations/en.lproj/Localizable.strings,offThePathAnnouncement,this announcemet is delivered if the user is off the path for 10 seconds or more.,"If you are having trouble following the route, press the ""get directions"" button.",
Clew/localizations/en.lproj/Localizable.strings,optionsButtonAccessibilityLabel,This is the accessibility label for the home button,Options,الخيارات
Clew/localizations/en.lproj/Localizable.strings,orientPhoneTutorialButtonText,"Text for the tutorial screem for phone position
   Title for the setting options part of the tutorial",Holding Your Phone for Best Results,
Clew/localizations/en.lproj/Localizable.strings,orientPhoneTutorialInstructionTextParagraph1,Text that explains how to orient the phone for the best experience using Clew Paragraph 1,"Clew uses your phone's camera and inertial sensors to track your position as you move around the environment and when you navigate a route. Holding your phone in the correct pose or orientation is essential in order for the app to work correctly. You should hold your phone in the portrait orientation (vertically), with the rear camera facing forward.",
Clew/localizations/en.lproj/Localizable.strings,orientPhoneTutorialInstructionTextParagraph2,Text that explains how to orient the phone for the best experience using Clew Paragraph 2,"It is important to maintain the phone in the vertical pose, with the rear camera facing forward (pointed away from your body) whenever you are navigating or saving a route. Maintaining the phone in this pose helps reduce errors from the app.",
Clew/localizations/en.lproj/Localizable.strings,orientPhoneTutorialInstructionTextParagraph3,Text that explains how to orient the phone for the best experience using Clew Paragraph 3,The following exercise will help you practice holding your phone in the correct pose for Clew. Tap the Practice button to begin.,
Clew/localizations/en.lproj/Localizable.strings,orientPhoneTutorialPracticeButton,,Practicing the Correct Phone Pose,
Clew/localizations/en.lproj/Localizable.strings,orientPhoneTutorialPracticeInstructionsParagraph1,Instructions for practicing holding phone activity paragraph 1,Now you can practice holding your phone in the correct pose for using Clew. Remember that the rear camera should face forward or away from you.,
Clew/localizations/en.lproj/Localizable.strings,orientPhoneTutorialPracticeInstructionsParagraph2,Instructions for practicing holding phone activity paragraph 2,Begin the exercise by moving your phone from a horizontal pose to a more vertical pose. Your phone will buzz and make a distinct tone the further you are off from the correct pose. You'll then hear a success chime when you achieve the correct vertical pose. Try moving your phone in and out of the correct pose a couple of times to hear the difference.,
Clew/localizations/en.lproj/Localizable.strings,orientPhoneTutorialPracticeInstructionsParagraph3,Instructions for practicing holding phone activity paragraph 3,Now it's your turn. Tap the Start button to begin.,
Clew/localizations/en.lproj/Localizable.strings,orientPhoneTutorialPracticeStart,start orient phone practice,Start,
Clew/localizations/en.lproj/Localizable.strings,orientPhoneTutorialPracticeStop,stop orient phone practice,Stop,
Clew/localizations/en.lproj/Localizable.strings,orientPhoneTutorialPracticeSuccess,Text when user has completed the phone position practice,Nice Job! You now know how to hold the phone in the correct pose. You can keep practicing or go to the next section.,
Clew/localizations/en.lproj/Localizable.strings,orientPhoneTutorialPracticeTitle,Title for holding phone practice,Practicing the Correct Phone Pose,
Clew/localizations/en.lproj/Localizable.strings,orientPhoneTutorialTip1,Tip for holding phone against chest,Try holding your phone against your chest when you're navigating a route to ensure it remains in the correct vertical pose with the camera facing directly in front of you.,
Clew/localizations/en.lproj/Localizable.strings,orientPhoneTutorialTip2,Tip for using Clew with cane or guide dog,We also recommend that you hold the phone in the opposite hand that you use to work with your white cane or guide dog.,
Clew/localizations/en.lproj/Localizable.strings,orientPhoneTutorialTipsTitle,Tips for holding phone title,Tips,
Clew/localizations/en.lproj/Localizable.strings,pauseButtonAccessibilityLabel,Pause,Pause session,إيقاف مؤقت
Clew/localizations/en.lproj/Localizable.strings,pausingNavigationTutorialText,Instruction for how to pause navigation,You can pause Clew if you want to initiate the return navigation at a later time. Pausing Clew will require you to set an 'anchor point'. The anchor point stores important orientation and directional information and is needed to realign you to the correct path. The following module will teach you how to use anchor points.,
Clew/localizations/en.lproj/Localizable.strings,pausingNavigationTutorialTitle,Title for the pause navigation section of the tutorial,Pausing Navigation,
Clew/localizations/en.lproj/Localizable.strings,physicalAlignmentTutorialTextParagraph1,Text of the physical alignment part of the tutorial paragraph 1,"Physical alignment sets the anchor point using the phone's inertial sensors. This method requires you to hold the phone in the horizontal or flat pose with the screen facing up, and press the top (short edge) of the phone against a vertical edge, like against a wall, a doorframe or a table.",
Clew/localizations/en.lproj/Localizable.strings,physicalAlignmentTutorialTextParagraph2,Text of the physical alignment part of the tutorial paragraph 2,Press the align button and wait for the countdown. The anchor point will be saved at the end of the countdown.,
Clew/localizations/en.lproj/Localizable.strings,physicalAlignmentTutorialTitle,Title of the physical alignment part of the tutorial,Physical Alignment,
Clew/localizations/en.lproj/Localizable.strings,playVoiceNoteButtonAccessibilityLabel,This is the accessibility label for the button which allows the user to replay their recorded voice note when loading an anchor point.,Play recorded voice note,تشغيل الملاحظة الصوتية المسجلة
Clew/localizations/en.lproj/Localizable.strings,practiceTutorialTitle,"button for practicing a skill in the tutorial
   Text for practice button
   Text for the begin button of the first following route practice.
   Text for the begin practice for the second following route practice.",Practice,
