file,id,note,English,Arabic
Clew/localizations/en.lproj/Localizable.strings,settingsWalkThroughSetUnitsMetricButton,Metric option button text,Metric (meters),
Clew/localizations/en.lproj/Localizable.strings,settingsWalkThroughSetUnitsText,Set units page text,"When providing directional cues, Clew may announce distance using either metric units (meters) or Imperial units (Feet). Please select the unit system that's best for you.",
Clew/localizations/en.lproj/Localizable.strings,settingsWalkThroughSetUnitsTitle,Set units page title,Units of Distance,
Clew/localizations/en.lproj/Localizable.strings,settingsWalkThroughTitle,Settings Walk Through,Clew Initial Setup,
Clew/localizations/en.lproj/Localizable.strings,shareActionText,This is the text that appears when a user tries to share a saved route. This text is used in an option menu when a route is selected and it describes the action for share a route.,Share,مشاركة
Clew/localizations/en.lproj/Localizable.strings,sharingYourExperiencePop-UpContent,Disclaimer shown to the user when they open the app for the first time,Help us improve the app by logging your Clew experience. These logs will not include any images or personal information. You can turn this off in Settings.,ساعدنا على تحسين التطبيق عن طريق مشاركة تجربتك مع Clew. ولن تتضمن هذه البيانات أي صور أو معلومات شخصية. ويمكنك إيقاف تشغيل هذا الخيار عن طريق الإعدادات.
Clew/localizations/en.lproj/Localizable.strings,sharingYourExperiencePop-UpHeading,When opening the app for the first time,Sharing your experience with Clew,شارك تجربتك مع Clew
Clew/localizations/en.lproj/Localizable.strings,showAdjustOffsetSuggestionTitle,Enable Correct Phone / Body Alignment Alert,"Enable Automatic ""Correct Offset of Phone / Body""?",هل تريد تفعيل التصحيح التلقائي لإزاحة الهاتف / الجسم؟
Clew/localizations/en.lproj/Localizable.strings,signInWithAppleButtonText,This is the text which appears on the sign in with Apple buttton,Sign In,تسجيل الدخول
Clew/localizations/en.lproj/Localizable.strings,signInWithAppleDescription,A description of why we'd like the user to sign in with their Apple ID,"As we develop Clew, we're seeking feedback so we can make the app a better tool for navigation. Please sign in with Apple to help our team improve the app!","نعمل دائما على تطوير Clew، فمن المهم الحصول على تعليقات وآراء المستخدمين حول التطبيق، حتى نتمكن من جعله أداة أفضل للتنقل.
الرجاء تسجيل الدخول باستخدام آبل لمساعدة فريقنا على تحسين التطبيق!
"
Clew/localizations/en.lproj/Localizable.strings,signInWithAppleTitle,Signing in with apple id,Please sign in.,الرجاء تسجيل الدخول
Clew/localizations/en.lproj/Localizable.strings,signInwithAppleButtonAccessibilityLabel,,Sign In,
Clew/localizations/en.lproj/Localizable.strings,significantVersionChanges-Confirmation,What the user clicks to acknowledge the significant changes message and dismiss pop-up,Ok,موافق
Clew/localizations/en.lproj/Localizable.strings,significantVersionChanges-HelpMeWithSiri,What the user clicks to request help setting up Siri shortcuts,Setup Siri Shortcuts Now,
Clew/localizations/en.lproj/Localizable.strings,significantVersionChangesPop-UpContent,An alert shown to the user to alert them to the fact that significant changes have been made to the app.,"This new version of Clew features a route sharing feature and a redesigned workflow for saving routes. Please note that ""landmarks"" are now called ""anchor points"". Also, some menus previously on the home screen are now available through the ""options"" menu. See the help menu for more details.","يحتوي الإصدار الجديد من Clew على ميزة مشاركة الطريق. قد تم إعادة تصميم التطبيق لكي تتمكن من حفظ الطرق بكل سهولة. يرجى العلم بأنه ""قد تم إعادة تسمية العلامات المرجعية"" لتصبح ""نقاط ثابتة"". ، وقد تم نقل بعض القوائم من الشاشة الرئيسية لقائمة ""الخيارات"". اطلع على قائمة المساعدة للمزيد من المعلومات."
Clew/localizations/en.lproj/Localizable.strings,significantVersionChangesPop-UpHeading,The heading of a pop-up telling the user that significant changes have been made to this app version,Important Changes,تعديلات مهمة
Clew/localizations/en.lproj/Localizable.strings,significantVersionChangesPopHandsFree-UpContent,An alert shown to the user to alert them to the fact that significant changes have been made to the app.,"Now you can use Siri with this new version of Clew. Please note that you can only use Siri with ""Single Use Route"". Please ensure that you have enabled Hey Siri on your iPhone through Settings > Siri & Search > Listen for Hey Siri. You will now be prompted to add Siri shortcuts after each action you take, when this is done you can simply say: ""Hey Siri, Activity name"".",
Clew/localizations/en.lproj/Localizable.strings,singleUsePlayPauseViewText,Information displayed to the user on the play pause screen after they have recorded a single use route. This describes the functionality of the play and pause buttons.,"In order to immediately perform return navigation, press the play button and follow the instructions provided. In order to pause the session to perform return navigation at a later point, press the pause button and complete the anchor point procedure.",لكي تتمكن من الانتقال لِطريق العودة، اضغط على زر التشغيل، ثم تابع التعليمات. ولكي تتمكن من الإيقاف المؤقت والعودة للطريق لاحقاً، قم بالضغط على زر الإيقاف المؤقت، وتابع عمل النقطة الثابتة.
Clew/localizations/en.lproj/Localizable.strings,singleUseRouteAnchorPointText,Information on how to record an anchor point when used for pausing a single use route,"To be able to resume your tracking at a later point you need to record an anchor point for the end of your route. An anchor point records the position and alignment of your device so the app can reload your route from a temporary file. As a result the accuracy of your return navigation relies entirely on how accurately you can realign and position your phone with your saved anchor point at a later point. We suggest using the text and voice note buttons to record a text note and/or a voice recording which can help you realign your device to the anchor point you recorded at a later time.
To create an anchor point, hold your device flat with the screen facing up. Press the top (short) edge flush against a flat vertical surface (such as a wall) the ”align” button starts a %lu-second countdown. The countdown is intended to give you time to position your device; the anchor point will be saved at the end of the countdown.","""ولكي تتمكن من متابعة تنقلك في وقت لاحق، يجب عليك تسجيل نقطة ثابتة في نهاية الطريق.
تسجل النقطة الثابتة موقع واتجاه الهاتف الخاص بك، فيمكن للتطبيق إعادة تحميل الطريق عن طريق الملف المحفوظ.
نتيجة لذلك، تعتمد دقة الطريق المحفوظ على مدى قدرتك على المحاذاة ومطابقة الهاتف مع النقطة الثابتة التي تم تسجيلها.و
وننصحك باستخدام زرّي النص والملحوظة الصوتية لكتابة ملحوظة أو تسجيلها لمساعدتك على مطابقة الهاتف مع نفس النقطة التي قمت بتسجيلها.
وللقيام بتسجيل نقطة ثابتة: يجب عليك وضع هاتفك بشكل ثابت، ثم وجه الشاشة لأعلى واضغط على الجزء العلوي (الزاوية القصيرة من الهاتف) وسيبدأ العد التنازلي.
ويهدف العد التنازلي لمنحك الوقت لإجراء التعديلات النهائية على اتجاه جهازك. وسيتم حفظ النقطة الثابتة عندما ينتهي العد التنازلي."""
Clew/localizations/en.lproj/Localizable.strings,singleUseRouteAnchorPointToPausedStateAnnouncement,Announcements which signify the end of a process,Anchor point saved. You may now close the app and return later for return navigation.,تم حفظ النقطة الثابتة. يمكنك إغلاق التطبيق والعودة لاحقًا للتنقل عبر طريق العودة.
Clew/localizations/en.lproj/Localizable.strings,singleUseRouteButtonText,This is the text which appears on the single use route buttton,Single Use Route,طريق فردي
Clew/localizations/en.lproj/Localizable.strings,singleUseRouteToRecordingRouteAnnouncement,This is an announcement which is spoken when the user starts recording a single use route. it informs the user that they are recording a single use route.,Now recording a single use route.,جاري تسجيل طريق فردي
Clew/localizations/en.lproj/Localizable.strings,singleUseRouteTutorialButtonText,Title for the single use route part of the tutorial,Single Use Routes,
Clew/localizations/en.lproj/Localizable.strings,singleUseRouteTutorialInstructionTextParagraph1,Instructions for using the single use route paragraph 1,Clew's Single Use Routes feature helps you find your way back after going from one place to another. This feature records your path when you walk from point-A to point-B. It then provides you with the return route directions and necessary cues.,
Clew/localizations/en.lproj/Localizable.strings,singleUseRouteTutorialInstructionTextParagraph2,Instructions for using the single use route paragraph 2,"For example, you can perform a single use route when going from a lobby area to a room, and then you want to return back to the lobby area.",
Clew/localizations/en.lproj/Localizable.strings,singleUseRouteTutorialInstructionTextParagraph3,Instructions for using the single use route paragraph 3,The Single Use Route allows you to navigate a return route only once. The Save Routes feature allows you to navigate a route multiple times.,
Clew/localizations/en.lproj/Localizable.strings,siriWalkthroughButtonText,Title for the Siri Walk Through,Siri Shortcuts Setup,
Clew/localizations/en.lproj/Localizable.strings,siriWalkthroughCompleteText,Text for when you complete the Siri shortcut setup,Nice Job! Your Siri shortcuts are now ready for you to use. You can come back to Siri shortcuts to make any changes to the shortcuts at any time by tapping on the Main Menu icon or from within the tutorials.,
Clew/localizations/en.lproj/Localizable.strings,siriWalkthroughCompleteTitle,Title for when you complete the Siri shortcut setup,Siri Shortcuts Setup Complete,
Clew/localizations/en.lproj/Localizable.strings,siriWalkthroughSetEndRecordingShortcutText,The page text for setting the Siri shortcut for ending the route recording,"The setup will take you to Apple's Siri shortcuts where you'll write the phrase that you want Siri to recall as the voice command. We recommend using short phrases that are easy to remember and are specific to its feature or function. Some suggested phrases are: ""End the route"", ""Clew stop recording the route"". Tap the Setup button below to begin.",
Clew/localizations/en.lproj/Localizable.strings,siriWalkthroughSetEndRecordingShortcutTitle,The page title for setting the Siri shortcut for ending the route recording,Stop Recording Route,
Clew/localizations/en.lproj/Localizable.strings,siriWalkthroughSetNavigateBackText,Text for setting the Siri shortcut for ending the route recording,"The setup will take you to Apple's Siri shortcuts where you'll write the phrase that you want Siri to recall as the voice command. We recommend using short phrases that are easy to remember and are specific to its feature or function. Some suggested phrases are: ""Return me back"", ""Clew start return navigation"". Tap the Setup button below to begin.",
Clew/localizations/en.lproj/Localizable.strings,siriWalkthroughSetNavigateBackTitle,Title for setting the Siri shortcut for ending the route recording,Return Me Back,
Clew/localizations/en.lproj/Localizable.strings,siriWalkthroughSetRecordRouteShortcutText,The page text for the Siri shortcut for recording a route,"The setup will take you to Apple's Siri shortcuts where you'll write the phrase that you want Siri to recall as the voice command. We recommend using short phrases that are easy to remember and are specific to its feature or function. Some suggested phrases are: ""Start a single use route"", ""Clew start single use route"". Tap the Setup button below to begin.",
Clew/localizations/en.lproj/Localizable.strings,siriWalkthroughSetRecordRouteShortcutTitle,The page title for the Siri shortcut for recording a route,Start Single Use Route,
Clew/localizations/en.lproj/Localizable.strings,siriWalkthroughTutorialButtonText,Title for the siri walkthrough part of the tutorial,Siri Shortcuts,
Clew/localizations/en.lproj/Localizable.strings,siriWalkthroughTutorialInstructionTextParagraph1,Information about what the siri shortcuts are paragraph 1,Siri shortcuts offer a convenient and hand-free way to use apps by voice commands You can control certain functions within Clew using Siri voice commands. Please note that it's important to speak the correct voice command in order for the shortcut to work. The list below shows the currently available Siri shortcuts for Clew.,
Clew/localizations/en.lproj/Localizable.strings,siriWalkthroughTutorialInstructionTextParagraph2,Information about what the siri shortcuts are paragraph 2,Tap the 'Siri Shortcuts Setup' button if it's your first time using Siri for Clew.,
Clew/localizations/en.lproj/Localizable.strings,siriWalkthroughTutorialTitleText,Title for the Siri walkthrough part of the tutorial,Siri Shortcuts,
Clew/localizations/en.lproj/Localizable.strings,slightLeftDirection,Direction to user to take a slight left turn,Slight left,انعَطِف يساراً
Clew/localizations/en.lproj/Localizable.strings,slightRightDirection,Direction to user to take a slight right turn,Slight right,توجه إلى اليمين قليلاً
Clew/localizations/en.lproj/Localizable.strings,startAlignmentCountdownButtonAccessibilityLabel,this is athe accessibility label for the button which allows the user to start an alignment procedure when saving an anchor point,Start alignment countdown,بدء مؤقت المحاذاة
Clew/localizations/en.lproj/Localizable.strings,startNavigationShortcutDescription,The description to use for the starting to navigate a route Siri shortcut,Tell Clew to start navigating the route,
Clew/localizations/en.lproj/Localizable.strings,startNavigationShortcutSuggestedPhrase,This is the default invocation phrase suggested to the user for the start navigation shortcut,Clew Navigate Route,
Clew/localizations/en.lproj/Localizable.strings,startNavigationShortcutTitle,The title to use for the starting to navigate a route Siri shortcut,Navigate Route,
Clew/localizations/en.lproj/Localizable.strings,startRecordingVoiceNoteAccessibilityLabel,This is the accessibility label which is played when a user with voice over selects the button to record a voice recording in the voice recorder view,Record Voice Note,تسجيل ملحوظة صوتية
Clew/localizations/en.lproj/Localizable.strings,startReturnNavigationButtonAccessibilityLabel,The accessibility label for the button that allows user to start navigating back along their route.,Start navigation,بدء التنقل
Clew/localizations/en.lproj/Localizable.strings,startReturnNavigationButtonAcessabilityLabel,,Start return navigation,بدء التنقل إلى نقطة البداية
Clew/localizations/en.lproj/Localizable.strings,startSingleUseRouteRecordingShortcutDescription,The description to use for the single use route recording Siri shortcut,Tell Clew to you record a single use route!,
Clew/localizations/en.lproj/Localizable.strings,startSingleUseRouteRecordingShortcutSuggestedPhrase,This is the default invocation phrase suggested to the user for the single use route recording shortcut,Clew Record Single Use Route,
Clew/localizations/en.lproj/Localizable.strings,startSingleUseRouteRecordingShortcutTitle,The title to use for the single use route recording Siri shortcut,Record Single Use Route,
Clew/localizations/en.lproj/Localizable.strings,startedTrackingSessionAnnouncement,Voicing directions,Tracking session initialized.,تم تهيئة جلسة التنقل
Clew/localizations/en.lproj/Localizable.strings,startingReturnNavigationAnnouncement,This is an anouncement which is played when the user performs return navigation from the play pause menu. It signifies the start of a navigation session.,Starting navigation,جاري بدء التنقل
Clew/localizations/en.lproj/Localizable.strings,stopNavigationButtonAccessibilityLabel,The accessibility label of the button that allows user to stop navigating.,Stop navigation,إيقاف التنقل
Clew/localizations/en.lproj/Localizable.strings,stopRecordingButtonAccessibilityLabel,The accessibility label of the button that allows user to stop recording a route.,Stop recording,إيقاف التسجيل
Clew/localizations/en.lproj/Localizable.strings,stopRecordingShortcutDescription,The description to use for the stopping a route recording Siri shortcut,Tell Clew to stop recording the route,
Clew/localizations/en.lproj/Localizable.strings,stopRecordingShortcutSuggestedPhrase,This is the default invocation phrase suggested to the user for the  stop route recording shortcut,Clew Stop Recording,
Clew/localizations/en.lproj/Localizable.strings,stopRecordingShortcutTitle,The title to use for stopping a route recording,Stop Recording Route,
Clew/localizations/en.lproj/Localizable.strings,stopRecordingVoiceNoteAccessibilityLabel,This is the accessibility label which is played when a user with voice over selects the button to stop their voice recording,Stop Recording,تم إيقاف التسجيل
Clew/localizations/en.lproj/Localizable.strings,stoppedRecordingAnnouncement,An announcement which lets the user know that they have stopped recording the route.,You've now stopped recording the route,
Clew/localizations/en.lproj/Localizable.strings,straightDirection,Version of directions given when haptic feedback function is turned on (Simpler),Continue straight,تابع السير إلى الأمام
Clew/localizations/en.lproj/Localizable.strings,submitSurvey,this is the button text that submits the survey,Submit,إرسال
Clew/localizations/en.lproj/Localizable.strings,surveyPopoverTitle,Feedback,We'd love to get your feedback,نرغب في الحصول على رأيك
Clew/localizations/en.lproj/Localizable.strings,textOrVoiceNotesTutorialText,Text of text or voice notes page,Clew allows you to record a text or voice note to describe the location of your anchor point. This can be especially helpful when you want to find and realign yourself to the saved anchor point at a later time.,
Clew/localizations/en.lproj/Localizable.strings,textOrVoiceNotesTutorialTitle,Title of text or voice notes page,Text or Voice Notes,
Clew/localizations/en.lproj/Localizable.strings,thanksForFeedbackAnnouncement,This is read right after the user fills out a feedback survey.,Thank you for your feedback,شكرا جزيلا على تقديم رأيك
Clew/localizations/en.lproj/Localizable.strings,tipTutorialTitle,,Tips,
Clew/localizations/en.lproj/Localizable.strings,turnOnAdjustOffsetButton,This text appears on a button that turns on the adjust offset feature,Yes,نعم
Clew/localizations/en.lproj/Localizable.strings,tutorialRouteAlignmentText,Text describing the process of aligning to a tutorial route. This text shows up on the alignment screen.,"To begin the route, tap the ""start navigation"" button below and wait for the countdown.",
Clew/localizations/en.lproj/Localizable.strings,tutorialTitleText,Title of the Clew Tutorial Screen. Top of the first tutorial page,CLEW Tutorial,
Clew/localizations/en.lproj/Localizable.strings,uTurnDirection,Direction to the user to turn around,Turn around,انعطف للخلف
Clew/localizations/en.lproj/Localizable.strings,usingSingleUseRouteTutorialTextParagraph1,Instruction for how to use single use routes paragraph 1,Tap the Single Use Route button on the home screen to activate this feature. Clew will immediately begin recording your route.,
Clew/localizations/en.lproj/Localizable.strings,usingSingleUseRouteTutorialTextParagraph2,Instruction for how to use single use routes paragraph 2,Now you can navigate to where you want to go. Remember to hold your phone in the correct vertical pose with the rear camera facing forward. Tap the 'stop recording' button once you've arrived at your destination.,
Clew/localizations/en.lproj/Localizable.strings,usingSingleUseRouteTutorialTextParagraph3,Instruction for how to use single use routes paragraph 3,Tap the 'play' button to initiate the return route navigation. Clew will then guide you back to your starting point.,
Clew/localizations/en.lproj/Localizable.strings,usingSingleUseRouteTutorialTitle,Title for using single use route section,Using Single Use Routes,
Clew/localizations/en.lproj/Localizable.strings,voiceNoteRecorderPop-UpHeader,Voicenote,Voice Note Recorder,مسجل الصوت
Clew/localizations/en.lproj/Localizable.strings,waypointsTutorialInstructionTextParagraph1,Text that explains the concept of waypoints paragraph 1,Clew provides waypoints or virtual crumbs to keep you in the right orientation as you navigate the route. The app will play a distinct 'chime' when you pass through a waypoint or virtual crumb.,
Clew/localizations/en.lproj/Localizable.strings,waypointsTutorialInstructionTextParagraph2,Text that explains the concept of waypoints paragraph 2,Sighted users will see a colored crumb in the shape of a map point on the screen. The crumb color can be changed in the settings.,
Clew/localizations/en.lproj/Localizable.strings,waypointsTutorialTitleText,Title for the waypoints part of the tutorial,Waypoints or Virtual Crumbs,
Clew/Settings.bundle/en.lproj/Root.strings,1 second,,1 second,ثانية
Clew/Settings.bundle/en.lproj/Root.strings,2 seconds,,2 seconds,ثانيتين
Clew/Settings.bundle/en.lproj/Root.strings,3 seconds,,3 seconds,ثلاث ثواني
Clew/Settings.bundle/en.lproj/Root.strings,4 seconds,,4 seconds,أربع ثواني
Clew/Settings.bundle/en.lproj/Root.strings,5 seconds,,5 seconds,خمس ثواني
Clew/Settings.bundle/en.lproj/Root.strings,6 seconds,,6 seconds,ست ثواني
Clew/Settings.bundle/en.lproj/Root.strings,7 seconds,,7 seconds,سبع ثواني
Clew/Settings.bundle/en.lproj/Root.strings,8 seconds,,8 seconds,ثمانية ثواني
Clew/Settings.bundle/en.lproj/Root.strings,9 seconds,,9 seconds,تسع ثواني
Clew/Settings.bundle/en.lproj/Root.strings,10 seconds,,10 seconds,عشر ثواني
Clew/Settings.bundle/en.lproj/Root.strings,Alignment Timer Options,"""Settings"" = ""Settings""; // Comments: Title/header of the settings menu. & Comments: A header for the slider which adjusts the length of the alignment timer",Alignment Timer Options,خيارات مؤقت المحاذاة
Clew/Settings.bundle/en.lproj/Root.strings,Blue,Comments: The option for the markers to be blue.,Blue,أزرق
Clew/Settings.bundle/en.lproj/Root.strings,Crumb Color,Comments: The title of the menu that allows the user to change the color of each marker/goal that the user need to reach to get to their destination.,Crumb Color,اللون الخافت
Clew/Settings.bundle/en.lproj/Root.strings,Distance Units,Strings that are in the settings pop-up & Comments: The title of the menu that allows the user to change the units distance is displayed. with,Distance Units,وحدات المسافة
Clew/Settings.bundle/en.lproj/Root.strings,Enabled,,Enabled,مفعلة
Clew/Settings.bundle/en.lproj/Root.strings,Feedback Options,Comments: The header for choosing different ways to receive navigation directions/feedback.,Feedback Options,خيارات الاهتزازات
Clew/Settings.bundle/en.lproj/Root.strings,General Options,Comments: A header for the general options that could be adjusted,General Options,الإعدادات العامة
Clew/Settings.bundle/en.lproj/Root.strings,Green,Comments: The option for the markers to be green.,Green,أخضر
Clew/Settings.bundle/en.lproj/Root.strings,Group,"A single strings file, whose title is specified in your preferences schema. The strings files provide the localized content to display to the user for each of your preferences.",Group,المجموع
Clew/Settings.bundle/en.lproj/Root.strings,Haptic,Comments: The option for the user to get navigation directions through vibrations/sensations given by the phone.,Haptic,الحس اللمسي
Clew/Settings.bundle/en.lproj/Root.strings,Help us improve the app by logging your Clew experience. These logs will not include any images or personal information.,"Comments: A comment on what turning on the button of ""Send Logs"" does.",Help us improve the app by logging your Clew experience. These logs will not include any images or personal information.,ساعدنا على تحسين التطبيق عن طريق مشاركة تجربتك مع Clew. ولن تتضمن هذه البيانات أي صور أو معلومات شخصية.
Clew/Settings.bundle/en.lproj/Root.strings,Imperial (ft),Comments: The option of having imperial units.,Imperial (ft),وحدة القياس الإمبريالية (قدم)
