file,id,note,English,Arabic
Clew/en.lproj/InfoPlist.strings,CFBundleName,Bundle name,Clew,Clew
Clew/en.lproj/InfoPlist.strings,Clew Route Document,,Clew Route Document,طريق Clew الموثوق
Clew/en.lproj/InfoPlist.strings,NSCameraUsageDescription,Privacy - Camera Usage Description,Clew needs to access your camera to track your orientation.,يحتاج Clew للوصول إلى الكاميرا لكي يتمكن من تتبع اتجاهك
Clew/en.lproj/InfoPlist.strings,NSMicrophoneUsageDescription,Privacy - Microphone Usage Description,Permission to use the microphone is required to use the voice notes feature.,يجب الحصول على إِذن المايكروفون لكي تتمكن من استخدام ميزة الملاحظات الصوتية
Clew/localizations/en.lproj/Localizable.strings, and proceed upstairs,Additional directions given to user telling them to climb stairs, and proceed upstairs,قم بصعود الدرج
Clew/localizations/en.lproj/Localizable.strings,"""%@""",No comment provided by engineer.,"""%@""",
Clew/localizations/en.lproj/Localizable.strings,%@ %@,No comment provided by engineer.,%1$@ %2$@,
Clew/localizations/en.lproj/Localizable.strings,1o'clockDirection,Version of directions given when haptic feedback function is turned off (Clock directions),Slight right towards 1 o'clock,إلى اليمين قليلاً نحو الساعة الواحدة
Clew/localizations/en.lproj/Localizable.strings,2o'clockDirection,direction to the user to turn towards the 2 o'clock direction,Slight right towards 2 o'clock,إلى اليمين قليلاً نحو الساعة الثانية
Clew/localizations/en.lproj/Localizable.strings,4o'clockDirection,direction to the user to turn towards the 4 o'clock direction,Turn towards 4 o'clock,انعَطِف نحو الساعة الرابعة
Clew/localizations/en.lproj/Localizable.strings,5o'clockDirection,direction to the user to turn towards the 5 o'clock direction,Turn around towards 5 o'clock,انعَطِف إلى الخلف نحو الساعة الخامسة
Clew/localizations/en.lproj/Localizable.strings,6o'clockDirection,direction to the user to turn towards the 6 o'clock direction,Turn around towards 6 o'clock,انعَطِف إلى الخلف نحو الساعة السادسة
Clew/localizations/en.lproj/Localizable.strings,7o'clockDirection,direction to the user to turn towards the 7 o'clock direction,Turn around towards 7 o'clock,انعَطِف إلى الخلف نحو الساعة السابعة
Clew/localizations/en.lproj/Localizable.strings,8o'clockDirection,direction to the user to turn towards the 8 o'clock direction,Turn towards 8 o'clock,انعَطِف نحو الساعة الثامنة
Clew/localizations/en.lproj/Localizable.strings,10o'clockDirection,direction to the user to turn towards the 10 o'clock direction,Slight left towards 10 o'clock,إلى اليسار قليلا نحو الساعة العاشرة
Clew/localizations/en.lproj/Localizable.strings,11o'clockDirection,direction to the user to turn towards the 11 o'clock direction,Slight left towards 11 o'clock,إلى اليسار قليلا نحو الساعة الحادية عشر
Clew/localizations/en.lproj/Localizable.strings,Clew is a versitile tool for traveling from point A to B. Below are some examples of what situations current users find Clew helpful.,No comment provided by engineer.,Clew is a versitile tool for traveling from point A to B. Below are some examples of what situations current users find Clew helpful.,
Clew/localizations/en.lproj/Localizable.strings,Clew needs to access your camera to track your orientation.,Info.plist,Clew needs to access your camera to track your orientation.,يحتاج Clew للوصول إلى الكاميرا لكي يتمكن من تتبع اتجاهك
Clew/localizations/en.lproj/Localizable.strings,ClewIntroTutorialText,Text on the first page of the tutorial that describes Clew,"Welcome to Clew! Clew helps you navigate and explore indoor spaces by using your phone's camera and inertial sensors. It acts as a 'sighted companion' that helps guide you along a route by providing audio directions and cues. Clew works best within indoor spaces, where GPS doesn't work or is unreliable.",
Clew/localizations/en.lproj/Localizable.strings,ClewIntroTutorialTitle,"Intro to Clew Tutorial Title
   Title for Clew Intro",Intro to Clew,
Clew/localizations/en.lproj/Localizable.strings,Exit,No comment provided by engineer.,Exit,
Clew/localizations/en.lproj/Localizable.strings,PausingARouteOrRecordingAAnchorPointContentParagraph1,This is a content paragraph in the Pausing a Route or Recording a Anchor Point section of the help menu which talks about why an allignment process is necessary,"The procedure for pausing the route and recording an anchor point are the same. The key idea is that in order to reuse routes, your phone must be able to align its current position with a position from the recorded route. In some cases, Apple's ARKit will be able to automatically do this alignment (for example, when the camera sees a distinctive visual feature that can be matched to the recording); however, in many situations this will not be possible.",تعتبر عملية الايقاف المؤقت للطريق وتسجيل نقطة ثابتة بمثابة الشيء نفسه. تكمن الفكرة الرئيسية بأنك عندما تود استخدام الطريق المسجل مرة أخرى، يجب عليك وضع الهاتف بنفس الطريقة التي قمت بتسجيل الطريق بها. في بعض الأحيان، سيقوم الواقع المعزز الخاص بApple بعمل هذا الأمر تلقائيا، (على سبيل المثال، عندما تلتقط الكاميرا ميزة بصرية ظاهرة، فيمكن مطابقتها مع التسجيل) وفي معظم الأوقات يكون هذا الأمر غير متاح.
Clew/localizations/en.lproj/Localizable.strings,PausingARouteOrRecordingAAnchorPointContentParagraph2,This is the second paragraph in the Pausing a Route and Recording a Anchor Point section of the help menu. This paragraph discusses the process of creating a Anchor Point including reasoning for why a Anchor Points are necessary and some tips for most effective use of the feature.,"In order to align your position in such cases you must be able to place the phone in a position and orientation such that you can reliably return the phone to that same position and orientation when reloading a saved route. While it is not crucial that you position the phone in exactly the same place (although the more accurately you can do this, the better the app will work), you must be able to place the phone in precisely the same orientation. To make it easy to return the phone to the same orientation, you should hold your phone flat with the screen facing up and press the top (short-edge) of your phone flush with a vertical surface (like a wall). More instructions are provided in the app when you activate the pause feature or the create anchor point feature.","ولكي تتمكن من عمل هذا الأمر بشكل جيد، يجب عليك وضع الهاتف باتجاه ثابت، بحيث يمكنك العودة لهذا الاتجاه عندما ترغب في إعادة تحميل الطريق المحفوظ مسبقا.
فليس من الضروري وضع الهاتف في نفس المكان بالضبط (فكلما فعلت ذلك جيدا، سيعمل التطبيق بشكل أفضل)، ويجب عليك أن تكون قادرا دوما على وضع الهاتف باتجاه ثابت.
ولتسهيل عملية إعادة الهاتف إلى نفس الاتجاه، يجب عليك وضع هاتفك بشكل ثابت، ثم وجه الشاشة لأعلى واضغط على الجزء العلوي (الزاوية القصيرة من الهاتف). سيتم عرض المزيد من المعلومات داخل التطبيق عند تفعيل ميزة الإيقاف المؤقت أو ميزة إنشاء النقطة الثابتة."
Clew/localizations/en.lproj/Localizable.strings,PausingARouteOrRecordingAAnchorPointHeader,This is a section heading in the help documentation menu,Pausing a route or recording an Anchor Point,إيقاف الطريق مؤقتاً أو تسجيل نقطة ثابتة
Clew/localizations/en.lproj/Localizable.strings,Permission to use the microphone is required to use the voice notes feature.,,Permission to use the microphone is required to use the voice notes feature.,يجب الحصول على إِذن المايكروفون لكي تتمكن من استخدام ميزة الملاحظات الصوتية
Clew/localizations/en.lproj/Localizable.strings,Reset Tutorial Progress,No comment provided by engineer.,Reset Tutorial Progress,
Clew/localizations/en.lproj/Localizable.strings,Settings,Settings & Comments: Title/header of the settings menu.,Settings,الإعدادات
Clew/localizations/en.lproj/Localizable.strings,What Can I Use Clew For?,No comment provided by engineer.,What Can I Use Clew For?,
Clew/localizations/en.lproj/Localizable.strings,You could use Clew to navigate between your table and the restroom in a resturant.,No comment provided by engineer.,You could use Clew to navigate between your table and the restroom in a resturant.,
Clew/localizations/en.lproj/Localizable.strings,"You could use Clew when visting a hotel, by saving a Clew route from the front door to the elevator and then save a route from the elevator to your room. Then you could use Clew to navigate those routes whenever you like.",No comment provided by engineer.,"You could use Clew when visting a hotel, by saving a Clew route from the front door to the elevator and then save a route from the elevator to your room. Then you could use Clew to navigate those routes whenever you like.",
Clew/localizations/en.lproj/Localizable.strings,addingALandmarkTutorialTextParagraph1,Instruction for how to add a landmark paragraph 1,Voice notes allow you to record a landmark or leave specific information that you want to hear later when navigating in the return direction. To leave a voice note:,
Clew/localizations/en.lproj/Localizable.strings,addingALandmarkTutorialTextParagraph2,Instruction for how to add a landmark paragraph 2,Tap the voice note button at any time that you are recording a route. The app will then open the voice recorder. Press the record button to leave a voice memo.,
Clew/localizations/en.lproj/Localizable.strings,addingALandmarkTutorialTextParagraph3,Instruction for how to add a landmark paragraph 3,Tap the stop recording button and resume recording your route.,
Clew/localizations/en.lproj/Localizable.strings,addingALandmarkTutorialTextParagraph4,Instruction for how to add a landmark paragraph 4,"When you navigate your route, Clew will play your voice note when you pass through your recorded landmark. You can record as many voice notes as you want.",
Clew/localizations/en.lproj/Localizable.strings,addingALandmarkTutorialTitle,Title for the add a landmark  section of the tutorial,Adding a Landmark - Voice Notes,
Clew/localizations/en.lproj/Localizable.strings,adjustOffsetAlertContent,this is the content of an alert which tells the user that they should consider enabling the adjust offset feature.,"While you were recording this route, the app determined that your phone's rear camera was not pointing straight ahead. When navigating the recorded route, if your phone is not pointing straight ahead, the app's directional guidance may be confusing. If it is difficult for you to keep you phone pointing straight ahead, the app can automatically adjust its guidance so that it is relative to your body rather than the phone's direction.  Would you like enable this feature?  You can always disable this feature in the settings menu under ""Correct Offset of Phone / Body.""  Important details of this feature are available in the help menu.","عند قيامك بتسجيل هذا الطريق, لاحظ التطبيق بأن الكاميرا الخلفية لهاتفك لم تكن موجهة للأمام مباشرة.
وبما أن هاتفك لم يكن موجها للأمام مباشرة، فعند التنقل في الطريق المسجل، ربما تخطئ الاتجاهات قليلا.
إذا كان من الصعب عليك وضع الهاتف في اتجاه ثابت، فيمكن للتطبيق تعديل اتجاهاته تلقائيا، بحيث يكون التطبيق معتمدا على جسمك بدلا من كاميرا الهاتف.
هل تريد تفعيل هذه الميزة؟
ويمكنك دائما تعطيل هذه الميزة عن طريق قائمة الإعدادات داخل خيار  ""ضبط موازنة الهاتف مع الجسم.""
تتوفر معلومات مهمة لهذه الميزة داخل قائمة المساعدة."
Clew/localizations/en.lproj/Localizable.strings,adjustOffsetReminderAnnouncement,This is the announcement which is spoken after starting navigation if the user has enabled the Correct Offset of Phone / Body option.,Correction for phone / body offset will be updated as you start walking.,سيتم تحديث التصحيح التلقائي لإزاحة الهاتف / الجسم عندما تبدء بالسير
Clew/localizations/en.lproj/Localizable.strings,alignToAnchorPointButtonText,The text shown on the button that aligns to the anchor point during the tutorial,Find Anchor Point,
Clew/localizations/en.lproj/Localizable.strings,anchorPointAlignmentText,Text describing the process of aligning to an anchorpoint. This text shows up on the alignment screen.,Please align your device with your previously recorded anchor point. To do this hold your device flat with the screen pointing up. Press the top (short) edge flush with the same vertical surface that you used to create the anchor point. Activating the align button will start an alignment countdown this is intended to give you time to make final adjustments to the positioning of your device. At the end of the countdown the alignment will be taken and the device will provide an announcement indicating that the anchor point was saved.,"الرجاء محاذة هاتفك مع نفس النقطة الثابتة التي قمت بتسجيلها مسبقًا. وللقيام بذلك، يجب عليك وضع هاتفك بشكل ثابت، ثم وجه الشاشة لأعلى واضغط على الجزء العلوي (الزاوية القصيرة من الهاتف)، استخدم نفس الطريقة المستخدمة عند تسجيل النقطة الثابتة.
عند تفعيل زر المحاذاة سيبدأ العد التنازلي للمحاذاة، ويهدف هذا الزر لمنحك الوقت لإجراء التعديلات النهائية على اتجاه جهازك. في نهاية العد التنازلي، سيتم اعتماد اتجاه الجهاز وسيعلمك الهاتف بأنه قد تم حفظ النقطة الثابتة بنجاح."
Clew/localizations/en.lproj/Localizable.strings,anchorPointIntroductionToSavedText,This is the text which delineates the text that a user saved witht their saved anchor point. This text is shown when a suer loads an anchor point and the text that the user saved with their anchor point appears right after this string.,The Anchor Point information you entered is: ,معلومات النقطة الثابتة التي أدخلتها هي:
Clew/localizations/en.lproj/Localizable.strings,anchorPointPop-UpCancel,A button for user to click which will close the pop up without saving any information the user put in,Don't specify this information,لا تُفصّل هذهي المعلومات
Clew/localizations/en.lproj/Localizable.strings,anchorPointPracticeAlignTextParagraph1,Align to anchor point page instructions paragraph 1,Nice Job! You've set an anchor point!,
Clew/localizations/en.lproj/Localizable.strings,anchorPointPracticeAlignTextParagraph2,Align to anchor point page instructions paragraph 2,"Now that you've saved an anchor point, try walking away from it- or wait a few minutes to return to the next exercise.",
Clew/localizations/en.lproj/Localizable.strings,anchorPointPracticeAlignTitle,Align to anchor point page title,Align to Anchor Point,
Clew/localizations/en.lproj/Localizable.strings,anchorPointPracticeFeedbackBadText,anchor point not well aligned text,"Oh no, try again! You were poorly aligned to the saved anchor point. This would have resulted in a route navigation with significant errors. Try practicing again to get a perfect alignment.",
Clew/localizations/en.lproj/Localizable.strings,anchorPointPracticeFeedbackGoodText,anchor point well aligned text,"Good job! You were fairly aligned to the saved anchor point, which would have resulted in a route navigation with some potential misalignment. Try practicing again to get a perfect alignment.",
Clew/localizations/en.lproj/Localizable.strings,anchorPointPracticeFeedbackPerfectText,anchor point perfectly aligned text,"Great job! You were very well aligned to the saved anchor point, which would have resulted in a very good route navigation. You now know how to find and align to anchor points and you're ready to start saving routes.",
Clew/localizations/en.lproj/Localizable.strings,anchorPointPracticeRetryAlignButton,button text to retry aligning the anchor point,Retry Finding Anchor Point Step,
Clew/localizations/en.lproj/Localizable.strings,anchorPointPracticeRetryButton,button text to retry setting the anchor point,Restart Practice,
Clew/localizations/en.lproj/Localizable.strings,anchorPointPracticeSetTutorialTextParagraph1,Set an anchor point practice page instructions paragraph 1,"This exercise will have you practice setting an anchor point. Remember to choose a location for your anchor point that you can easily find at some later time. You'll practice setting the anchor point using the physical alignment method. Remember to position your phone flat with the screen facing up against a vertical edge of a wall, or doorframe or a table.",
Clew/localizations/en.lproj/Localizable.strings,anchorPointPracticeSetTutorialTextParagraph2,Set an anchor point practice page instructions paragraph 2,"Press the Set Anchor Point button, position your phone, and wait for the countdown.",
Clew/localizations/en.lproj/Localizable.strings,anchorPointPracticeSetTutorialTitle,"You could also try pressing the top edge of your phone against a table, wall or doorway and then setting the anchor point. That way when you go to find the spot where you should set the anchor point again, you only have to find a table or wall again and then you know you're at least pretty close."";",Setting an Anchor Point,
Clew/localizations/en.lproj/Localizable.strings,anchorPointTextHeading,Anchor Points,Anchor Point information,معلومات النقطة الثابتة
Clew/localizations/en.lproj/Localizable.strings,anchorPointTextPlaceholder,A placeholder that appears in text box which the user uses to enter a text label for an anchor point.,Enter Anchor Point information,أدخل معلومات النقطة الثابتة
Clew/localizations/en.lproj/Localizable.strings,anchorPointTextPop-UpConfirmation,"A button for user to click to confirm the text note they added to their anchor point and close a pop-up
   What the user clicks to acknowledge a message and dismiss pop-up",Ok,موافق
Clew/localizations/en.lproj/Localizable.strings,anchorPointTextPrompt,Prompts user to enter descriptive text about their anchor point,Enter text about the Anchor Point that will allow you to find the exact same point later on.,أدخل نصًا حول النقطة الثابتة التي تمكنك من العثور عليها لاحقا.
Clew/localizations/en.lproj/Localizable.strings,anchorPointsTutorialText,Instructions for setting anchor points,Setting anchor points is an important skill that is needed in order to save routes or pause navigation. Anchor points allow Clew to record your position and orientation within the route's environment. The anchor point realigns you to the correct path whenever you want to navigate a route that has been saved for later use and they are essential to Clew's navigation accuracy.,
Clew/localizations/en.lproj/Localizable.strings,anchorPointsTutorialTitle,"this is the title of the anchor points tutorial section
   Title for the anchor point part of the tutorial",Setting and Finding Anchor Points,
Clew/localizations/en.lproj/Localizable.strings,appFeaturesCurrentVersionHeading,this is a heading in the help documentation and part of the app features section.,Current Version,الإصدار الحالي
Clew/localizations/en.lproj/Localizable.strings,appFeaturesFutureVersionsContent,this is a paragraph in the app Features section of the help documentation which describes the features which are under development for future versions of the app.,We are working on improving alignment mechanisms to make it easier and quicker to begin navigation of routes.,نحن نعمل جاهدين على تحسين آلِيَّة مناسبة لجعل عملية الملاحة  أسهل وأسرع.
Clew/localizations/en.lproj/Localizable.strings,appFeaturesFutureVersionsHeader,This is a heading in the app features section of the help documentation.,Future Versions,الإصدارات المستقبلية
Clew/localizations/en.lproj/Localizable.strings,appFeaturesHeading,this is a heading in the help documentation. it is also used for the creation of the accessibility labels used to inform the user as to how to interact with the help documantatio's accordian menu,App features,مميزات التطبيق
Clew/localizations/en.lproj/Localizable.strings,appSoundsAndTheirMeaningsContent,This is a paragraph in the App sounds and their meanings section.,"In addition to the auditory guidance that you get when navigating along a route (described previously), there are some additional sounds that help you understand what is currently happening with the app. If you have enabled the speech feedback option in the app settings, each of these sounds is accompanied by speech that briefly explains the sounds meaning. Note that these sounds are not delivered when you are in the help menu (to avoid distracting you while you are reading through the help information).","بالإضافة إلى الإشارات الصوتية التي تحصل عليها أثناء تنقلك عبر الطريق، (الموصوفة مسبقا)، تتوفر أيضا مجموعة إضافية من الأصوات التي تساعدك على فهم الإحداث الحالية التي تَحدُث في التطبيق.
إذا قمت مسبقا بتفعيل خيار تعليقات الكلام عن طريق إعدادات التطبيق، فسيكون كل صوت من هذه الأصوات مصحوبا بجملة تَِصف المعنا الخاص بالصوت.
لاحظ بأن هذه الأصوات لا تصلك عندما تكون في قائمة المساعدة (وذلك لتجنب إزعاجك أثناء تنقلك بين المعلومات)."
Clew/localizations/en.lproj/Localizable.strings,appSoundsAndTheirMeaningsHeader,This is a section header in the help documentation,App sounds and their meanings,أصوات التطبيق ومعانيها
Clew/localizations/en.lproj/Localizable.strings,appSoundsAndTheirMeaningsMotionTrackingWarningSoundBullet,This is a bullet point which describes the motion tracking warning sound and its meaning,Motion tracking warning sound: this sound is a short recording of a stringed instrument playing a slightly scratchy note. This sound indicates that the app's position tracking has been degraded either due to the phone moving too rapidly or due to the environment not having an adequate amount of visual detail. The latter condition occurs if your environment is too dark or if the camera is occluded.,"صوت تحذير تتبع الحركة: هو عبارة عن مقطع صوتي قصير لآلة وترية خشنة. ويشير هذا الصوت بأن تتبع التطبيق للحركة قد انخفض إما بسبب تحرك الهاتف بسرعة أو بسبب انعدام الضوضاء في المكان. ويحدث هذا الأمر إذا كانت المنطقة مظلمة جدا أو إذا كان مدخل الكاميرا مغلقاً.
"
Clew/localizations/en.lproj/Localizable.strings,appSoundsAndTheirMeaningsNormalMotionTrackingSoundBullet,This is a bullet point which describes the normal motion tracking sound and its meaning,"Normal motion tracking sound: this sound is a short recording of a brass instrument. It indicates that the app's position tracking has entered into the &quot;normal&quot; state. If the app has just started up this means that the motion tracking is now active. If the app previously experienced diminished accuracy, see next sound description, it means that the motion tracking has recovered. If you hear this sound after loading or resuming a route, this means that ARKit has been able to automatically align the route to the recording.",صوت تتبع الحركة العادي: هو عبارة عن صوت آلة نحاسية قصير. ويشير هذا الصوت إلى أن تتبع الحركة في التطبيق هو طبيعياً. إذا بدأ التطبيق للتو، فهذا يعني أن تتبع الحركة نشط. وإذا كان التطبيق قد مرة سابقًا بضعف في الإضاءة، فقرء الوصف الصوتي التالي، فهذا يعني أن تتبع الحركة قد عاد لوضعه الطبيعي. أما إذا استمعت لهذا الصوت بعد تحميل أو استئناف الطريق، فهذا يعني أن الواقع الافتراضي قد تمكن من تعديل المسار تلقائياً.
