file,id,note,English,Arabic
Clew/localizations/en.lproj/Localizable.strings,appfeaturesCurrentVersionContent,this is a paragraph in the app features section of the help menu which describes the main features of Clew,"Clew allows you to record routes using your phone so that you can then navigate them at a later point in time with precise, automatic guidance from the app. Clew can be used in situations where you want to immediately navigate back to your starting location (e.g., if you went somewhere with a sighted guide or if it is harder to navigate the reverse journey) or when you want to remember a route that you are learning so you can navigate it more confidently in the future.  Importantly, Clew does not use your phone's GPS, so it can be used indoors.","يسمح لك Clew بتسجيل الطرق عن طريق هاتفك والذي يمكنك من استخدامهم في أوقات لاحقة بمصاحبة توجيهات تلقائية ودقيقة من التطبيق.
يمكن استخدام Clew لأغراض متعددة، إذا رغبت مثلا بالعودة مجددا إلى نقطة البداية لموقعك، (فعلى سبيل المثال)، إذا خرجت لمكان مع شخص مبصر، أو إذا كان من الصعب عليك العودة مجددا.
أو حتى إذا رغبت في تذكر طريق لكي تتعلمه، يمكنك التنقل به بحرية مطلقة في المستقبل.
معلومة مهمة: لا يستخدم Clew خدمات تحديد الموقع لهاتفك، فَيتيح لك هذا استخدامه في الأماكن المغلقة."
Clew/localizations/en.lproj/Localizable.strings,applesARWorldMapTutorialTextParagraph1,Text of the AR world map part of the tutorial paragraph 1,"Apple's ARWorld map can help make the process of finding and aligning to a saved anchor point easier. Especially for those that have newer iPhone models and for environments with consistent, artificial lighting, the physical alignment can simply be achieved by holding the phone in the vertical pose. However, we recommend that you be consistent in holding the phone pose and relocalizing yourself as best as possible to the originally saved anchor point in order to ensure the best accuracy from Clew.",
Clew/localizations/en.lproj/Localizable.strings,applesARWorldMapTutorialTextParagraph2,Text of the AR world map part of the tutorial paragraph 2,Next you will have a chance to practice setting and aligning to anchor points.  Tap the 'Practice' button to start the exercise.,
Clew/localizations/en.lproj/Localizable.strings,applesARWorldMapTutorialTitle,Title of the AR world map part of the tutorial,Apple's ARWorld Map,
Clew/localizations/en.lproj/Localizable.strings,automaticAlignmentPlayPauseViewText,Play/Pause text,You have been automatically realigned with your route. Press the play button to perform navigation.,تم إعادة محاذاتك تلقائيًا مع الطريق. اضغط على زر التشغيل لبدء التنقل.
Clew/localizations/en.lproj/Localizable.strings,automaticEmailTextWhenSharingRoutes,Sharing routes,Check out this route!,قم بتجربة هذا الطريق
Clew/localizations/en.lproj/Localizable.strings,badServiceButtonAccessibilityLabel,,Bad,رديء 
Clew/localizations/en.lproj/Localizable.strings,buttonTexttoExitTutorial,Tutorial,Exit,
Clew/localizations/en.lproj/Localizable.strings,buttonTexttoNextScreenTutorial,Text on the button that brings user to the next page of the tutorial,Next,
Clew/localizations/en.lproj/Localizable.strings,buttonTexttoSkip,"Text on skip button
   Text on the button that brings user to the next page of the tutorial
   Text on the button that brings user to the next section of the tutorial",Skip,
Clew/localizations/en.lproj/Localizable.strings,cancelPop-UpButtonLabel,A button which closes the current pop up,Cancel,إلغاء
Clew/localizations/en.lproj/Localizable.strings,clewAppLogoAccessibilityText,HelpCompiler.swift,The Clew App Logo,شعار تطبيق Clew
Clew/localizations/en.lproj/Localizable.strings,clewHelpTitle,This is the top heading of the help documentation,Clew Help,مساعد Clew 
Clew/localizations/en.lproj/Localizable.strings,climbStairsDirection,Strings from Navigation, and proceed upstairs,قم بصعود الدرج
Clew/localizations/en.lproj/Localizable.strings,completedNavigationAnnouncement,An announcement which is played to notify the user that they have arrived at the end of their route.,You've arrived.,لقد وصلت
Clew/localizations/en.lproj/Localizable.strings,contractSectionAccessibilityTag,This is a tag that is spoken by the accessibility elements. This tag describes the action a user must take to collapse one of the sections in the help documentation,contract section,طي القسم
Clew/localizations/en.lproj/Localizable.strings,currentSiriShortcuts,this is header text for the list of current Siri shortcuts the user has created within the Clew app,Current Siri Shortcuts for Clew,
Clew/localizations/en.lproj/Localizable.strings,declineTurnOnAdjustOffsetButton,A button which declines to turn on the adjust offset feature,No,لا
Clew/localizations/en.lproj/Localizable.strings,deleteActionText,This is the text that appears when a user tries to delete a saved route. This text is used in an option menu when a route is selected and it describes the action for deleting a route.,Delete,حذف
Clew/localizations/en.lproj/Localizable.strings,descendStairsDirection,This is a direction which instructs the user to descend stairs, and proceed downstairs,قم بنزول الدرج
Clew/localizations/en.lproj/Localizable.strings,directionalCuesTutorialInstructionText,Instructions for the directional cues part of the tutorial,"Clew will provide directional cues as soon as you begin navigating a route and to keep oriented correctly. The app will announce directions whenever you pass through a waypoint or virtual crumb. The directional cues include: continue straight, slight right, slight left, turn right, turn left. Clew will also announce when you have reached the end of the route.",
Clew/localizations/en.lproj/Localizable.strings,directionalCuesTutorialTitleText,Title for the directional cues part of the tutorial,Directional Cues,
Clew/localizations/en.lproj/Localizable.strings,dismissSurvey,"dismiss the keyboard in the feedback form
   this is the button text that dismisses the survey
   This is used for dismissing popovers",Dismiss,استبعاد
Clew/localizations/en.lproj/Localizable.strings,endOfTutorialMainText,the main text at the end of the Clew tutorial,Nice Job! You've completed the Clew tutorial. You can come back to this information at anytime through the menu options or by pressing the help button on the Clew main screen.,
Clew/localizations/en.lproj/Localizable.strings,endOfTutorialTitleText,The title of the tutorial page that shows up when you complete the tutorial,End of Tutorial,
Clew/localizations/en.lproj/Localizable.strings,enterAnchorPointDescriptionButtonAccessibilityLabel,This is the accessibility label for the button which allows the user to save a text based description of their anchor point when saving a route. This feature should allow the user to more easily realign with their anchorpoint.,Enter text to help you remember this Anchor Point,أدخل نصًا لمساعدتك على تذكر نقطة الثبات هذه
Clew/localizations/en.lproj/Localizable.strings,enterAnchorPointVoiceNoteButtonAccessibilityLabel,This is the accessibility label for the button which allows the user to save a voice note description of their anchor point when saving a route. This feature should allow the user to more easily realign with their anchorpoint.,Record audio to help you remember this Anchor Point,سجل مقطعا صوتيا لمساعدتك على تذكر نقطة الثبات هذه
Clew/localizations/en.lproj/Localizable.strings,excessiveMotionDegradedTrackingAnnouncemnt,An announcement which lets the user know that there is too much movement of their device and thus the app's ability to track a route has been lowered.,"Excessive motion.
Tracking performance is degraded.",حركة زائدة. تتبع الأداء منخفض.
Clew/localizations/en.lproj/Localizable.strings,exitTutorial,Text on the button that exits the tutorial after the user has gone through it the whole thing,Exit Tutorial,
Clew/localizations/en.lproj/Localizable.strings,expandSectionAccessibilityTag,This is a tag that is spoken by the accessibility elements. This tag describes the action a user must take to expand one of the sections in the help documentation,expand section,فتح القسم
Clew/localizations/en.lproj/Localizable.strings,feedbackButtonAccessibilityLabel,,Feedback,الاهتزازات
Clew/localizations/en.lproj/Localizable.strings,feedbackMenuTitle,FeedbackViewController.swift,Contact Us,ملاحظات حول Clew
Clew/localizations/en.lproj/Localizable.strings,findPathPractice1InstructionTextParagraph1,Text for the instructions of the first following route practice paragraph 1,This first exercise will have you practice the simple route in order to get you accustomed to Clew's sounds and feedback. This first route will guide you forward a few steps and then announce the end of the route. Pay particular attention to the sounds and directional cues.,
Clew/localizations/en.lproj/Localizable.strings,findPathPractice1InstructionTextParagraph2,Text for the instructions of the first following route practice paragraph 2,Please make sure that you're in a familiar area with sufficient space to move about before you begin this exercise. ,
Clew/localizations/en.lproj/Localizable.strings,findPathPractice1InstructionTextParagraph3,Text for the instructions of the first following route practice paragraph 3,Tap the 'Practice' button and then tap 'Play' to begin the exercise.,
Clew/localizations/en.lproj/Localizable.strings,findPathPractice1Title,Text for the title of the first following route practice.,Practice Your First Route,
Clew/localizations/en.lproj/Localizable.strings,findPathPractice2InstructionText,Text for the instructions of the second following route practice.,Here you will practice following a Clew Route. Make sure you are in a familiar place with some open space around you. This path will guide you forward a few steps and then you will pass through a waypoint and be instructed to turn right. Then you will take a few more steps and then arrive. Select begin to enter the practice route.,
Clew/localizations/en.lproj/Localizable.strings,findPathPractice2Title,Text for the title of the second following route practice.,Practice Second Path,
Clew/localizations/en.lproj/Localizable.strings,findPathPracticeSuccess1Text,Text for the success of the first practice route.,You've completed your first route. Continue to the next exercise to try another route.,
Clew/localizations/en.lproj/Localizable.strings,findPathPracticeSuccess2Text,Text for the success of the second practice route.,You now know how to navigate a route! You may continue the tutorial or go to the Home Screen and try performing a Single Use Route. Remember that practice makes perfect!,
Clew/localizations/en.lproj/Localizable.strings,findPathPracticeSuccessTitle,Text for the title of the success page for following route practice.,Congratulations!,
Clew/localizations/en.lproj/Localizable.strings,findPathTutorialButtonText,Title for the finding and following path part of the tutorial,Following a Route,
Clew/localizations/en.lproj/Localizable.strings,findPathTutorialInstructionText,Text that explains what it sounds and feels like to be on the path and following the path,"Clew will make sounds, haptic feedback and provide directional audio cues whenever you are navigating a route. These distinct sounds, feedback and directional cues enable you to navigate the route correctly. They help you know when you are correctly on the path or if you are slightly off the correct path or have completely deviated from the route.",
Clew/localizations/en.lproj/Localizable.strings,findingAnAnchorPointTutorialTextParagraph1,Text of the finding your anchor point part of the tutorial paragraph 1,"The accuracy of the navigation will depend on how well you can realign yourself to the saved anchor point. To find and realign yourself to a saved anchor point, you should try to position yourself as closely as possible to the exact location of the originally saved anchor point.",
Clew/localizations/en.lproj/Localizable.strings,findingAnAnchorPointTutorialTextParagraph2,Text of the finding your anchor point part of the tutorial paragraph 2,"Finding the saved anchor point from the physical alignment requires you to hold your phone in the same horizontal or flat pose, pressing it against the same edge that was used to set the anchor point.",
Clew/localizations/en.lproj/Localizable.strings,findingAnAnchorPointTutorialTextParagraph3,Text of the finding your anchor point part of the tutorial paragraph 3,Finding the saved anchor point from the visual alignment simply requires you to hold the phone in the vertical pose and realign the camera to the same location that was used to set the original anchor point.,
Clew/localizations/en.lproj/Localizable.strings,findingAnAnchorPointTutorialTitle,Title of the finding your anchor point part of the tutorial,Finding an Anchor Point,
Clew/localizations/en.lproj/Localizable.strings,findingSavedAnchorPointTextParagraph1,Find anchor point page instructions paragraph 1,"This exercise will have you practice finding and realigning yourself to a saved anchor point. After some time, try returning to the same location of your anchor point. Next realign your phone to the same position.",
Clew/localizations/en.lproj/Localizable.strings,findingSavedAnchorPointTextParagraph2,Find anchor point page instructions paragraph 2,"Hold your phone in the same horizontal or flat pose, pressing it against the same edge that was used to set the anchor point.",
Clew/localizations/en.lproj/Localizable.strings,findingSavedAnchorPointTextParagraph3,Find anchor point page instructions paragraph 3,Press the Find Anchor Point button. Wait for the countdown to complete. The app will provide feedback about how closely aligned you were to the saved anchor point.,
Clew/localizations/en.lproj/Localizable.strings,findingSavedAnchorPointTitle,Find anchor point page title,Finding the Saved Anchor Point,
Clew/localizations/en.lproj/Localizable.strings,findingSavedRoutesTutorialButtonText,"""voiceNotesTutorialInstructionText"" = ""When recording a saved route, there is a button on the right that allows you to record a voice note. A voice note is a note you can leave yourself, that will play when you go to use the save route that you are recording. It can be any information that is helpful to you, such as noting where a landmark like a doorway or front desk is as you pass, or instructions for your future self. Later when you go to use a save route the voice notes will appear as speaker icons on your path at the point they were recorded. As you pass the note will play."";",Finding Saved Routes,
Clew/localizations/en.lproj/Localizable.strings,findingSavedRoutesTutorialInstructionText,,"Once you save a route, it can be found in your Saved Routes List. You can enter the list from the third button on the home screen. From the list click the route that you want to follow, line your phone up with your anchor point and follow the route.",
Clew/localizations/en.lproj/Localizable.strings,findingSavedRoutesTutorialInstructionTextParagraph1,Instructions for finding saved routes paragraph 1,Clew stores all the saved routes within your Saved Routes List. Tap the Saved Routes Button on the Home Screen when you want to navigate a previously saved route. Scroll through the list and tap on the route name.,
Clew/localizations/en.lproj/Localizable.strings,findingSavedRoutesTutorialInstructionTextParagraph2,Instructions for finding saved routes paragraph 2,"Select the direction of travel that you wish to navigate. You'll be able to navigate the route from either 'Start-to-End' or in the reverse direction, from 'End-to-Start'. Please be aware of the direction of travel that you wish to navigate.",
Clew/localizations/en.lproj/Localizable.strings,findingSavedRoutesTutorialInstructionTextParagraph3,Instructions for finding saved routes paragraph 3,"Next, find and realign yourself to the corresponding Anchor Point. Finally, wait for the countdown to complete and the navigation will begin.",
Clew/localizations/en.lproj/Localizable.strings,fixedTrackingAnnouncement,Let user know that the ARKit tracking session has returned to its normal quality (this is played after the tracking has been restored from thir being insuficent visual features or excessive motion which degrade the tracking),Tracking performance normal.,تتبع الأداء عادي
Clew/localizations/en.lproj/Localizable.strings,followingARouteAuditoryBeepsContent,This is a paragraph in the following a route section of the help documentation which describes the menaing of audityory meps during navigation.,"Assuming you have enabled sound feedback in the app settings and your iphone doesn't have system sounds muted, the phone will make a beeping sound when it is facing in the correct direction of travel for the route. It is important to keep in mind that this feedback is relative to the direction of the phone, rather than your body. When you achieve a milestone in the route (we call these anchor points), you will hear a different sound effect.","على فرض بأنك قمت بتفعيل وصف الأصوات من إعدادات التطبيق وكان الآيفون الخاص بك غير مكتوماً، فعند التنقل عبر الطريق سيصدر الهاتف صفارات صوتية عندما يكون موجها بالاتجاه الصحيح.
من المهم الأخذ بعين الاعتبار بأن هذه العلامات مرتبطة بالهاتف بدلا من جسمك.
وعند قطع مسافة من الطريق (نسمي هذا بالنقاط الثابتة)،
ستستمع لمجموعة من المؤثرات الصوتية المختلفة."
Clew/localizations/en.lproj/Localizable.strings,followingARouteAuditoryBeepsHeader,This is a header inside the following a route section of the help documentation,Auditory beeps,الصافِرات السمعية
Clew/localizations/en.lproj/Localizable.strings,followingARouteContent,This is a paragraph which is in the following a route section of the help documentation.,"Once you activate the start navigation feature, the app will provide you with instructions to navigate back to your starting location. The app provides feedback in the following formats.","عند القيام بتفعيل ميزة بدء التنقل، سيزودك التطبيق بإرشادات تمكنك من العودة مجددا إلى نقطة البداية.
وسيزودك التطبيق بصيغ الإرشادات التالية:"
Clew/localizations/en.lproj/Localizable.strings,followingARouteCorrectOffsetAutomaticallyContentParagraph1,this is paragraph 1 in the following a route section of the help documentation which describes the functionality of the correct for phone / body offset feature.,"By default, Clew provides guidance in reference to the direction your phone is facing.  If you have difficulty perceiving your phone's direction, the guidance the app provides may be confusing.  If this is an issue for you, you can enable automatic correction of phone / body offset below.","يساعدك Clew على التنقل عبر الطريق ويستخدم افتراضياً الاتجاه الخاص بهاتفك.
ولِهذا، إذا كنت تسير بشكل مستقيم ولم يكن هاتفك موجهاً إلى الأمام، فمن الممكن أن تكون الاتجاهات التي يزودك بها التطبيق خاطئة.
إذا وجدت هذا الأمر صعبا، فيمكنك تفعيل إعداد التصحيح التلقائي لإزاحة الهاتف / الجسم.
وعندما يكون هذا الخيار مفعلا، سيستخدم التطبيق بعضا من العلامات أثناء تنقلك ليتأكد من أن هاتفك غير موجه إلى الأمام مباشرةً.
(في نفس الجهة التي تتوجه نحوها)
إذا لاحظ التطبيق بأن الكاميرا الخلفية لهاتفك لم تكن موجهة للأمام مباشرة، سيقوم التطبيق بتعديل اتجاهاته تلقائيا، بحيث يعتمد التطبيق على جسمك بدلا من اتجاه الهاتف."
Clew/localizations/en.lproj/Localizable.strings,followingARouteCorrectOffsetAutomaticallyContentParagraph2,this is paragraph 2 in the following a route section of the help documentation which describes the functionality of the correct for phone / body offset feature.,"If you enable this setting, you should scan for the next waypoint by rotating your body while holding your phone fixed (e.g., against braced against your chest).","عند استخدامك لخيار التصحيح التلقائي لإزاحة الهاتف / الجسم، فمن الأفضل لك وضع الهاتف مقابل القفص الصدري، ثم قم بالدوران بجسمك للعثور على الاتجاه الصحيح الذي يجب اتباعه
(فعند الدوران بجسمك، يجب أن يبقى الهاتف مقابل القفص الصدري ملتفا معك حيثما تذهب.)
لاحظ بأن المشي الخلفي والجانبي يؤثر بشكل سلبي على التطبيق وذلك بفصل الارتباط بين الهاتف وجسمك.
إذا حدث ذلك، فيمكنك تعطيل هذا الخيار، أو القيام بالمشي للأمام لعدة خطوات وذلك لإعادة حسابات التطبيق."
Clew/localizations/en.lproj/Localizable.strings,followingARouteCorrectOffsetAutomaticallyHeader,This is a header inside the following a route section of the help documentation,Automatic Correction of Phone / Body Offset,التصحيح التلقائي لإزاحة الهاتف / الجسم
Clew/localizations/en.lproj/Localizable.strings,followingARouteHapticFeedbackContent,this is a paragraph in the following a route section of the help documentation which describes the meaning of haptic feedback that the user recieves during navigation.,"Assuming you have enabled haptic feedback in the app settings and you have an iPhone that supports haptics (iPhone 7 or later should work), the phone will provide haptic vibration when it is facing in the correct direction of travel for the route. It is important to keep in mind that this feedback is relative to the direction of the phone, rather than your body. When you achieve a milestone in the route (we call these anchor points), you will feel a stronger haptic vibration.","على فرض بأنك قمت بتفعيل اهتزازات الحس اللمسي من إعدادات التطبيق وكان الآيفون الخاص بك يدعم اهتزازات الحس اللمسي، (آيفون 7 أو أعلى)، عند التنقل عبر الطريق، سيصدر الهاتف اهتزازات لمسية عندما يكون موجها بالاتجاه الصحيح.
من المهم الأخذ بعين الاعتبار بأن هذه العلامات مرتبطة بالهاتف بدلا من جسمك.
وعند قطع مسافة من الطريق (نسمي هذا بالنقاط الثابتة).
ستشعر أيضا باهتزازات لمسية أقوى.

"
Clew/localizations/en.lproj/Localizable.strings,followingARouteHapticFeedbackHeader,This is a header inside the following a route section of the help documentation,Haptic feedback,اهتزازات الحس اللمسي
Clew/localizations/en.lproj/Localizable.strings,followingARouteHeader,This is a header for the following a route section of the help documentation.,Following a route,متابعة الطريق
Clew/localizations/en.lproj/Localizable.strings,followingARouteSpeechFeedbackContent,this is a paragraph in the following a route section of the help documentation which describes the meaning of auditory speech feedback during navigation.,"Assuming you have enabled speech feedback in the app settings and voice over is on, the phone will provide you with voice directions whenever you encounter an anchor point on your route, start a route, or complete a route. If you want to hear voice directions again, you can use the &quot;Get Directions&quot; button.","على فرض بأنك قمت بتفعيل الإرشادات الصوتية من إعدادات التطبيق وكان ال Voiceover مشغلاً، سيعطيك الهاتف إرشادات صوتية عند مصادفة نقاط ثابتة في طريقك, بدء الطريق, تابع الطريق.
إذا رغبت بالاستماع إلى الإرشادات الصوتية مجددا، فيمكنك استخدام زر الحصول على الاتجاهات،"
Clew/localizations/en.lproj/Localizable.strings,followingARouteSpeechFeedbackHeader,This is a header inside the following a route section of the help documentation,Speech feedback,إرشادات الكلام
